{
  "$schema": "https://json-schema.org/draft/2020-12/schema",
  "additionalProperties": false,
  "properties": {
    "benchmark_family": {
      "const": "entity-resolution-ambiguity-v1"
    },
    "benchmark_main": {
      "pattern": "^[0-9a-f]{40}$",
      "type": "string"
    },
    "claim_boundary": {
      "type": "object"
    },
    "corpus_binding": {
      "additionalProperties": false,
      "properties": {
        "files": {
          "additionalProperties": {
            "pattern": "^[0-9a-f]{64}$",
            "type": "string"
          },
          "type": "object"
        },
        "records": {
          "const": 2323
        },
        "selected_seed": {
          "const": 20260926
        },
        "test_records": {
          "const": 1614
        },
        "train_records": {
          "const": 709
        },
        "truth_records": {
          "const": 1614
        }
      },
      "required": [
        "selected_seed",
        "records",
        "train_records",
        "test_records",
        "truth_records",
        "files"
      ],
      "type": "object"
    },
    "evaluation": {
      "type": "object"
    },
    "execution": {
      "type": "object"
    },
    "pre_execution_state": {
      "type": "object"
    },
    "schema": {
      "const": "qvra-entity-resolution-ambiguity-execution/v1"
    },
    "source_binding": {
      "additionalProperties": false,
      "properties": {
        "generator_sha256": {
          "pattern": "^[0-9a-f]{64}$",
          "type": "string"
        },
        "materialization_receipt_sha256": {
          "pattern": "^[0-9a-f]{64}$",
          "type": "string"
        },
        "materializer_sha256": {
          "pattern": "^[0-9a-f]{64}$",
          "type": "string"
        },
        "projected_corpus_sha256": {
          "pattern": "^[0-9a-f]{64}$",
          "type": "string"
        }
      },
      "required": [
        "generator_sha256",
        "materializer_sha256",
        "projected_corpus_sha256",
        "materialization_receipt_sha256"
      ],
      "type": "object"
    },
    "systems": {
      "const": [
        "qvra-native-er-v1",
        "splink",
        "dedupe"
      ]
    }
  },
  "required": [
    "schema",
    "benchmark_family",
    "benchmark_main",
    "source_binding",
    "corpus_binding",
    "systems",
    "execution",
    "evaluation",
    "claim_boundary",
    "pre_execution_state"
  ],
  "type": "object"
}
